{
  "schema": "jqstar-doctor-rules/1",
  "reviewedAt": "2026-09-06",
  "reviewAfter": "2027-03-03",
  "reviewPolicy": "Recheck through a ticket when support, entries, configuration, plugin API, ecosystem facts, or parser formats change; expired rules emit a warning and are never fetched at runtime.",
  "authority": [
    {
      "path": "quality/release-contract.json",
      "pointer": "/support",
      "sha256": "d93e2f696573afe46bd24816eb9b0950ebcae7ee42af54719879b83d981c7fa3"
    },
    {
      "path": "quality/release-contract.json",
      "pointer": "/stableEntries",
      "sha256": "e0505aa3bdc3b8b6bc9e3b4db7219b44bdbe183dc4db32f4d50149d565036a49"
    },
    {
      "path": "quality/release-contract.json",
      "pointer": "/package/pluginApiVersion",
      "sha256": "8e633b4f41f99d4c388915bc852f2143cf4e9f5eaad70c76a81d4f4aa629eec1"
    },
    {
      "path": "quality/jquery-ecosystem.json",
      "pointer": "",
      "sha256": "aa2630146c4a86228e9cb864a47859bc37528ef05d812ac113e14efe55392609"
    }
  ],
  "compatibility": {
    "package": ">=1.0.0 <2",
    "version": "1.1.0",
    "pluginApi": "0.1.0",
    "node": ">=24",
    "npmForReleaseConstruction": ">=11",
    "jquery": ">=3.7.1 <5",
    "bridges": {
      "turbo": ">=8.0.21 <8.1.0",
      "htmx": ">=2.0.0 <2.1.0"
    },
    "configVersions": [0, 1],
    "targetConfigVersion": 1,
    "entrypoints": [
      {
        "subpath": ".",
        "formats": ["esm", "commonjs", "umd"],
        "since": "1.0.0",
        "deprecated": false
      },
      {
        "subpath": "./core",
        "formats": ["esm", "commonjs"],
        "since": "1.0.0",
        "deprecated": false
      },
      {
        "subpath": "./csp",
        "formats": ["esm", "commonjs"],
        "since": "1.0.0",
        "deprecated": false
      },
      {
        "subpath": "./ui",
        "formats": ["esm", "commonjs"],
        "since": "1.0.0",
        "deprecated": false
      },
      {
        "subpath": "./datastar",
        "formats": ["esm", "commonjs"],
        "since": "1.0.0",
        "deprecated": false
      },
      {
        "subpath": "./testing",
        "formats": ["esm", "commonjs"],
        "since": "1.0.0",
        "deprecated": false
      },
      {
        "subpath": "./datastar/testing",
        "formats": ["esm", "commonjs"],
        "since": "1.0.0",
        "deprecated": false
      },
      {
        "subpath": "./turbo",
        "formats": ["esm", "commonjs"],
        "since": "1.0.0",
        "deprecated": false
      },
      {
        "subpath": "./htmx",
        "formats": ["esm", "commonjs"],
        "since": "1.0.0",
        "deprecated": false
      },
      {
        "subpath": "./stores",
        "formats": ["esm", "commonjs"],
        "since": "1.1.0",
        "deprecated": false
      },
      {
        "subpath": "./persist",
        "formats": ["esm", "commonjs"],
        "since": "1.1.0",
        "deprecated": false
      },
      {
        "subpath": "./inspect",
        "formats": ["esm", "commonjs"],
        "since": "1.1.0",
        "deprecated": false
      },
      {
        "subpath": "./ui.css",
        "formats": ["css"],
        "since": "1.0.0",
        "deprecated": false
      }
    ]
  },
  "lockfiles": {
    "npm": [2, 3],
    "pnpm": ["9.0"],
    "yarnClassic": [1],
    "yarnModern": [4, 5, 6, 7, 8]
  },
  "limits": {
    "fileBytes": 2097152,
    "totalBytes": 16777216,
    "workspaces": 256,
    "packages": 4096,
    "diagnostics": 1024,
    "scalarLength": 256,
    "dataDepth": 32,
    "workspaceDepth": 8,
    "elapsedMs": 10000
  },
  "diagnostics": [
    {
      "code": "JQS_NODE_INCOMPATIBLE",
      "severity": "error",
      "summary": "Node does not satisfy the supported runtime range.",
      "source": "docs/COMPATIBILITY.md",
      "documentation": "https://github.com/Ignibyte/jqstar/blob/main/docs/COMPATIBILITY.md",
      "evidenceInputs": ["node-version"],
      "correction": "Run doctor and the application on a supported Node version.",
      "reviewAfter": "2027-03-03"
    },
    {
      "code": "JQS_TOOLING_RANGE",
      "severity": "warning",
      "summary": "Declared npm version is outside the release-construction range.",
      "source": "docs/COMPATIBILITY.md",
      "documentation": "https://github.com/Ignibyte/jqstar/blob/main/docs/COMPATIBILITY.md",
      "evidenceInputs": ["manifest"],
      "correction": "Use the documented npm version when constructing a jQStar release; application package-manager choice remains yours.",
      "reviewAfter": "2027-03-03"
    },
    {
      "code": "JQS_PACKAGE_VERSION",
      "severity": "error",
      "summary": "A resolved package version is outside the supported range.",
      "source": "docs/COMPATIBILITY.md",
      "documentation": "https://github.com/Ignibyte/jqstar/blob/main/docs/COMPATIBILITY.md",
      "evidenceInputs": ["package-metadata"],
      "correction": "Select a supported version for this consumer and verify its resolved installation with your package manager.",
      "reviewAfter": "2027-03-03"
    },
    {
      "code": "JQS_PACKAGE_DUPLICATE",
      "severity": "warning",
      "summary": "Distinct package versions or installed copies were detected.",
      "source": "docs/COMPATIBILITY.md",
      "documentation": "https://github.com/Ignibyte/jqstar/blob/main/docs/COMPATIBILITY.md",
      "evidenceInputs": ["package-metadata"],
      "correction": "Review which application resolves each copy before choosing whether to deduplicate.",
      "reviewAfter": "2027-03-03"
    },
    {
      "code": "JQS_PEER_INCOMPATIBLE",
      "severity": "error",
      "summary": "Declared peer compatibility excludes the detected package version.",
      "source": "docs/COMPATIBILITY.md",
      "documentation": "https://github.com/Ignibyte/jqstar/blob/main/docs/COMPATIBILITY.md",
      "evidenceInputs": ["installed-metadata"],
      "correction": "Choose mutually compatible peer versions and check the package placement used by this consumer.",
      "reviewAfter": "2027-03-03"
    },
    {
      "code": "JQS_DECLARED_RANGE",
      "severity": "warning",
      "summary": "Declared package range does not intersect the supported range.",
      "source": "MIGRATING_TO_1.md",
      "documentation": "https://github.com/Ignibyte/jqstar/blob/main/MIGRATING_TO_1.md",
      "evidenceInputs": ["manifest"],
      "correction": "Review the declared range and intended supported version before editing your dependency manifest.",
      "reviewAfter": "2027-03-03"
    },
    {
      "code": "JQS_ENTRYPOINT_UNAVAILABLE",
      "severity": "error",
      "summary": "Requested entrypoint or format is unavailable in the detected artifact.",
      "source": "docs/COMPATIBILITY.md",
      "documentation": "https://github.com/Ignibyte/jqstar/blob/main/docs/COMPATIBILITY.md",
      "evidenceInputs": ["explicit-input"],
      "correction": "Choose a documented entrypoint and format available in the installed package version.",
      "reviewAfter": "2027-03-03"
    },
    {
      "code": "JQS_ENTRYPOINT_DEPRECATED",
      "severity": "warning",
      "summary": "Requested entrypoint is deprecated.",
      "source": "docs/COMPATIBILITY.md",
      "documentation": "https://github.com/Ignibyte/jqstar/blob/main/docs/COMPATIBILITY.md",
      "evidenceInputs": ["explicit-input"],
      "correction": "Follow the linked replacement guidance before the documented removal release.",
      "reviewAfter": "2027-03-03"
    },
    {
      "code": "JQS_ENTRYPOINT_USE",
      "severity": "info",
      "summary": "The requested entrypoint and format are recorded as explicit input.",
      "source": "docs/COMPATIBILITY.md",
      "documentation": "https://github.com/Ignibyte/jqstar/blob/main/docs/COMPATIBILITY.md",
      "evidenceInputs": ["explicit-input"],
      "correction": "Confirm this explicit argument matches the import your application intends to use.",
      "reviewAfter": "2027-03-03"
    },
    {
      "code": "JQS_PLUGIN_API",
      "severity": "error",
      "summary": "Declared plugin API range excludes this registrar version.",
      "source": "README.md",
      "documentation": "https://github.com/Ignibyte/jqstar/blob/main/README.md",
      "evidenceInputs": ["plugin-metadata"],
      "correction": "Install a plugin whose declared registrar range includes the supported plugin API version.",
      "reviewAfter": "2027-03-03"
    },
    {
      "code": "JQS_CONFIG_VERSION",
      "severity": "warning",
      "summary": "A known configuration schema upgrade is available.",
      "source": "docs/UPGRADES.md",
      "documentation": "https://github.com/Ignibyte/jqstar/blob/main/docs/UPGRADES.md",
      "evidenceInputs": ["config-metadata"],
      "correction": "Run doctor --upgrade-config to review a configuration plan before explicit apply.",
      "reviewAfter": "2027-03-03"
    },
    {
      "code": "JQS_CONFIG_UNSUPPORTED",
      "severity": "error",
      "summary": "Configuration uses an unsupported schema version.",
      "source": "docs/UPGRADES.md",
      "documentation": "https://github.com/Ignibyte/jqstar/blob/main/docs/UPGRADES.md",
      "evidenceInputs": ["config-metadata"],
      "correction": "Use a compatible doctor version or restore a known configuration schema; unknown migrations are not guessed.",
      "reviewAfter": "2027-03-03"
    },
    {
      "code": "JQS_ARTIFACT_IDENTITY",
      "severity": "error",
      "summary": "Installed package metadata or entrypoint files disagree with the expected identity.",
      "source": "docs/COMPATIBILITY.md",
      "documentation": "https://github.com/Ignibyte/jqstar/blob/main/docs/COMPATIBILITY.md",
      "evidenceInputs": ["installed-metadata"],
      "correction": "Review package provenance and installed metadata; restore the intended artifact using your normal package workflow.",
      "reviewAfter": "2027-03-03"
    },
    {
      "code": "JQS_OWNERSHIP_MISMATCH",
      "severity": "warning",